{
  "manifest_version": "1.0.0",
  "package_id": "chatgpt-2024-part-001",
  "created_at": "2026-07-21T08:00:00Z",
  "privacy_class": "private-source",
  "description": "Example manifest only. No private chat content is included in this public repository.",
  "source_platforms": [
    "ChatGPT"
  ],
  "time_range": {
    "start": "2024-01-01T00:00:00Z",
    "end": "2024-12-31T23:59:59Z"
  },
  "package_sha256": "0123456789abcdef0123456789abcdef0123456789abcdef0123456789abcdef",
  "files": [
    {
      "path": "raw/chatgpt/conversations.json",
      "sha256": "abcdef0123456789abcdef0123456789abcdef0123456789abcdef0123456789",
      "byte_size": 12345678,
      "media_type": "application/json",
      "source_platform": "ChatGPT",
      "record_kind": "native-export",
      "conversation_count": 250,
      "earliest_message_at": "2024-01-03T11:30:00Z",
      "latest_message_at": "2024-12-29T22:10:00Z",
      "contains_sensitive_material": true,
      "reconstructed": false,
      "original_filename": "conversations.json",
      "notes": [
        "Untouched source export; private source vault only."
      ]
    }
  ],
  "duplicate_groups": [],
  "notes": [
    "Replace example hashes and measurements with values calculated from the actual package."
  ]
}
